{
  "$schema": "./theme.schema.json",
  "brand": {
    "primary": "#3b82f6",
    "secondary": "#8b5cf6",
    "accent": "#ec4899",
    "success": "#10b981",
    "warning": "#f59e0b",
    "error": "#ef4444",
    "info": "#06b6d4"
  },
  "typography": {
    "fontFamily": {
      "base": "-apple-system, BlinkMacSystemFont, 'Segoe UI', Roboto, 'Helvetica Neue', Arial, sans-serif",
      "heading": "-apple-system, BlinkMacSystemFont, 'Segoe UI', Roboto, 'Helvetica Neue', Arial, sans-serif",
      "mono": "'SF Mono', Monaco, 'Cascadia Code', 'Roboto Mono', Consolas, 'Courier New', monospace"
    },
    "scale": {
      "xs": "0.75rem",
      "sm": "0.875rem",
      "base": "1rem",
      "lg": "1.125rem",
      "xl": "1.25rem",
      "2xl": "1.5rem",
      "3xl": "1.875rem",
      "4xl": "2.25rem",
      "5xl": "3rem"
    }
  },
  "spacing": {
    "0": "0rem",
    "1": "0.25rem",
    "2": "0.5rem",
    "3": "0.75rem",
    "4": "1rem",
    "5": "1.25rem",
    "6": "1.5rem",
    "8": "2rem",
    "10": "2.5rem",
    "12": "3rem",
    "16": "4rem",
    "20": "5rem",
    "24": "6rem"
  },
  "radius": {
    "sm": "0.25rem",
    "base": "0.5rem",
    "lg": "0.75rem",
    "full": "9999px"
  },
  "shadow": {
    "sm": "0 1px 2px 0 rgb(0 0 0 / 0.05)",
    "base": "0 1px 3px 0 rgb(0 0 0 / 0.1), 0 1px 2px -1px rgb(0 0 0 / 0.1)",
    "lg": "0 10px 15px -3px rgb(0 0 0 / 0.1), 0 4px 6px -4px rgb(0 0 0 / 0.1)",
    "xl": "0 20px 25px -5px rgb(0 0 0 / 0.1), 0 8px 10px -6px rgb(0 0 0 / 0.1)"
  }
}
